{
  "version": 1,
  "namespace": "agentflow",
  "identityFormat": "<namespace>:<role>",
  "collaborationProtocol": {
    "acceptanceOwner": "handover-sender",
    "deliveryOwner": "handover-receiver",
    "decisionPolicy": "owner-decides-objections-resolved",
    "classes": [
      "linear",
      "bilateral",
      "council",
      "human-gated"
    ],
    "deterministicFirst": true,
    "councilIsAdvisory": true
  },
  "roles": [
    {
      "slug": "product-manager",
      "qualifiedName": "agentflow:product-manager",
      "label": "Product manager",
      "kind": "lifecycle",
      "phase": 0,
      "source": "roles/product-manager",
      "purpose": "Define the problem, intended outcome, value, priority, and release intent without prescribing the solution method.",
      "owns": [
        "product.problem",
        "product.outcome",
        "product.release-intent"
      ],
      "contributesTo": [
        "analysis.scope",
        "delivery.release-readiness"
      ],
      "doesNotOwn": [
        "analysis.requirements",
        "architecture.design",
        "delivery.implementation"
      ],
      "inputs": [
        "user-request",
        "product-context"
      ],
      "outputs": [
        "problem-statement",
        "outcome-definition",
        "release-intent"
      ],
      "authority": {
        "defaultBoundary": "propose",
        "maximumBoundary": "propose",
        "mutationScopes": [
          "goal-records"
        ]
      },
      "behavior": {
        "steps": [
          "frame the problem and affected users",
          "define observable outcomes and priority"
        ],
        "failurePolicy": "block on an untestable outcome or unresolved product authority"
      },
      "completionCriteria": [
        "problem and outcome are explicit",
        "release intent is recorded or declared not applicable"
      ],
      "acceptsFrom": [],
      "sendsTo": [
        "agentflow:analyst"
      ],
      "collaboration": {
        "allowedModes": [
          "single-agent",
          "advisory",
          "council"
        ],
        "independence": "not-required"
      },
      "extensionPoints": [
        "methodPlays",
        "templates",
        "validators",
        "evidenceFields"
      ]
    },
    {
      "slug": "analyst",
      "qualifiedName": "agentflow:analyst",
      "label": "Analyst",
      "kind": "lifecycle",
      "phase": 1,
      "source": "roles/analyst",
      "purpose": "Turn product intent or a request into testable requirements, acceptance criteria, assumptions, and a bounded scope.",
      "owns": [
        "analysis.requirements",
        "analysis.acceptance-criteria",
        "analysis.scope"
      ],
      "contributesTo": [
        "architecture.constraints",
        "assurance.validation-plan"
      ],
      "doesNotOwn": [
        "product.priority",
        "architecture.design",
        "delivery.implementation"
      ],
      "inputs": [
        "problem-statement",
        "outcome-definition",
        "user-request"
      ],
      "outputs": [
        "requirements",
        "acceptance-criteria",
        "scope-boundary",
        "open-questions"
      ],
      "authority": {
        "defaultBoundary": "propose",
        "maximumBoundary": "propose",
        "mutationScopes": [
          "issue-requirements"
        ]
      },
      "behavior": {
        "steps": [
          "separate facts, assumptions, and questions",
          "express acceptance in observable terms"
        ],
        "failurePolicy": "block or return when scope cannot be made testable"
      },
      "completionCriteria": [
        "acceptance criteria are testable",
        "in-scope and out-of-scope boundaries are explicit"
      ],
      "acceptsFrom": [
        "agentflow:product-manager"
      ],
      "sendsTo": [
        "agentflow:architect"
      ],
      "collaboration": {
        "allowedModes": [
          "single-agent",
          "advisory",
          "parallel-discovery"
        ],
        "independence": "not-required"
      },
      "extensionPoints": [
        "methodPlays",
        "templates",
        "validators",
        "evidenceFields"
      ]
    },
    {
      "slug": "architect",
      "qualifiedName": "agentflow:architect",
      "label": "Architect",
      "kind": "lifecycle",
      "phase": 2,
      "source": "roles/architect",
      "purpose": "Define the technical design, constraints, quality attributes, risks, tradeoffs, and workflow profile.",
      "owns": [
        "architecture.design",
        "architecture.risk",
        "architecture.workflow-profile"
      ],
      "contributesTo": [
        "delivery.plan",
        "assurance.review"
      ],
      "doesNotOwn": [
        "analysis.acceptance-criteria",
        "delivery.implementation",
        "assurance.test-verdict"
      ],
      "inputs": [
        "requirements",
        "acceptance-criteria",
        "scope-boundary",
        "repository-context"
      ],
      "outputs": [
        "technical-design",
        "risk-register",
        "workflow-profile",
        "architecture-decisions"
      ],
      "authority": {
        "defaultBoundary": "propose",
        "maximumBoundary": "propose",
        "mutationScopes": [
          "architecture-records"
        ]
      },
      "behavior": {
        "steps": [
          "evaluate constraints and alternatives",
          "select a design and expose tradeoffs"
        ],
        "failurePolicy": "block on an unsafe or undecidable architecture boundary"
      },
      "completionCriteria": [
        "selected design satisfies acceptance and constraints",
        "material risks and mitigations are recorded"
      ],
      "acceptsFrom": [
        "agentflow:analyst"
      ],
      "sendsTo": [
        "agentflow:implementation-planner"
      ],
      "collaboration": {
        "allowedModes": [
          "single-agent",
          "advisory",
          "council"
        ],
        "independence": "recommended-for-high-risk"
      },
      "extensionPoints": [
        "methodPlays",
        "templates",
        "validators",
        "evidenceFields"
      ]
    },
    {
      "slug": "implementation-planner",
      "qualifiedName": "agentflow:implementation-planner",
      "label": "Implementation planner",
      "kind": "lifecycle",
      "phase": 3,
      "source": "roles/implementation-planner",
      "purpose": "Translate the approved design into an executable, ordered implementation, validation, documentation, and rollback plan.",
      "owns": [
        "delivery.plan",
        "assurance.validation-plan",
        "delivery.rollback-plan"
      ],
      "contributesTo": [
        "delivery.implementation",
        "documentation.change-plan"
      ],
      "doesNotOwn": [
        "architecture.design",
        "delivery.implementation",
        "assurance.test-verdict"
      ],
      "inputs": [
        "technical-design",
        "risk-register",
        "acceptance-criteria",
        "repository-context"
      ],
      "outputs": [
        "implementation-plan",
        "validation-plan",
        "documentation-plan",
        "rollback-plan"
      ],
      "authority": {
        "defaultBoundary": "propose",
        "maximumBoundary": "propose",
        "mutationScopes": [
          "planning-evidence"
        ]
      },
      "behavior": {
        "steps": [
          "map changes to owned files and contracts",
          "order implementation and validation with stop conditions"
        ],
        "failurePolicy": "return to architect when the design is not executable"
      },
      "completionCriteria": [
        "files, tests, documentation, and rollback are covered",
        "dependencies and stop conditions are explicit"
      ],
      "acceptsFrom": [
        "agentflow:architect",
        "agentflow:developer"
      ],
      "sendsTo": [
        "agentflow:developer"
      ],
      "collaboration": {
        "allowedModes": [
          "single-agent",
          "advisory"
        ],
        "independence": "not-required"
      },
      "extensionPoints": [
        "methodPlays",
        "templates",
        "validators",
        "evidenceFields"
      ]
    },
    {
      "slug": "developer",
      "qualifiedName": "agentflow:developer",
      "label": "Developer",
      "kind": "lifecycle",
      "phase": 4,
      "source": "roles/developer",
      "purpose": "Implement the approved plan within the declared scope and produce truthful change evidence.",
      "owns": [
        "delivery.implementation",
        "delivery.change-evidence"
      ],
      "contributesTo": [
        "documentation.implementation-coupled",
        "assurance.testability"
      ],
      "doesNotOwn": [
        "architecture.design",
        "assurance.test-verdict",
        "assurance.review-verdict"
      ],
      "inputs": [
        "implementation-plan",
        "technical-design",
        "acceptance-criteria",
        "repository-policy"
      ],
      "outputs": [
        "implementation",
        "change-evidence",
        "implementation-notes"
      ],
      "authority": {
        "defaultBoundary": "mutate-worktree",
        "maximumBoundary": "mutate-worktree",
        "mutationScopes": [
          "approved-plan-files"
        ]
      },
      "behavior": {
        "steps": [
          "implement the smallest complete approved change",
          "self-check scope and evidence before handoff"
        ],
        "failurePolicy": "return to planner for a planning defect and stop on unsafe scope expansion"
      },
      "completionCriteria": [
        "implementation matches the plan",
        "changed behavior and known limitations are recorded"
      ],
      "acceptsFrom": [
        "agentflow:implementation-planner",
        "agentflow:reviewer",
        "agentflow:technical-writer",
        "agentflow:pr-readiness"
      ],
      "sendsTo": [
        "agentflow:tester",
        "agentflow:implementation-planner"
      ],